{
  "catalogueId": "TB-SLO-CATALOGUE-V1",
  "catalogueVersion": "1.0.0",
  "summary": "What good looks like for every component of Tessera Bank that emits a metric. An objective here is a declaration about what the software promises, taken by the people who built it; the committed baseline beside it records what the estate actually did under a named workload model. The two are deliberately separate, and where a baseline cannot meet an objective that is recorded rather than quietly relaxed. Nothing in this document decides when to page, whom to page or at what burn rate: those are properties of a deployment and belong to the platform repositories, per ADR 0012.",
  "components": [
    {
      "componentId": "ledger-api",
      "path": "services/ledger-api",
      "stratum": "3",
      "exposure": "actuator-endpoint",
      "objectives": [
        {
          "objectiveId": "SLO-LEDGER-MOVEMENT-SUCCESS",
          "title": "A request to move money is answered rather than dropped on the floor",
          "sli": {
            "kind": "eventRatio",
            "meterName": "ledger.transfers",
            "exposedName": "ledger_transfers_total",
            "origin": "source",
            "tags": [
              "operation",
              "outcome"
            ],
            "good": "money-moving requests whose outcome was posted, replayed or rejected",
            "valid": "every money-moving request the ledger counted, over all five operations"
          },
          "target": 0.999,
          "windowDays": 30,
          "errorBudget": {
            "fraction": 0.001,
            "minutesPerWindow": 43.2
          },
          "introducedBy": "WP-09",
          "rationale": "A rejection is the ledger working: insufficient funds, a closed account, a currency mismatch are business outcomes and a rise in them is a question for the caller. Only failed is the ledger failing, and the outcome tag exists precisely so the two cannot be averaged into one meaningless graph. That separation is what makes this objective mean anything, and an objective stated over the whole counter instead would be met by a ledger refusing every payment."
        },
        {
          "objectiveId": "SLO-LEDGER-POSTING-LATENCY",
          "title": "Money moves quickly enough that callers do not time out and retry",
          "sli": {
            "kind": "eventRatio",
            "meterName": "ledger.posting.latency",
            "exposedName": "ledger_posting_latency_seconds",
            "origin": "source",
            "tags": [
              "operation",
              "outcome"
            ],
            "threshold": 0.5,
            "comparison": "<=",
            "good": "money-moving requests that did work and completed within the threshold",
            "valid": "money-moving requests that did work - rejections are counted rather than timed, because a validation failure that returns in a millisecond and a transfer that took two locks produce a percentile describing neither"
          },
          "target": 0.99,
          "windowDays": 30,
          "errorBudget": {
            "fraction": 0.01,
            "minutesPerWindow": 432.0
          },
          "introducedBy": "WP-09",
          "rationale": "Every transfer takes two row locks in a deterministic order and one global advisory lock held to commit, so this figure is where contention shows up first. Half a second is the point at which a caller's own timeout starts producing retries, and a retry arrives as a replay - which means this objective and the replay share of SLO-LEDGER-MOVEMENT-SUCCESS fail in that order, giving an operator one signal before the other."
        },
        {
          "objectiveId": "SLO-LEDGER-OUTBOX-FRESHNESS",
          "title": "An event the ledger wrote reaches the broker while it is still current",
          "sli": {
            "kind": "timeRatio",
            "meterName": "ledger.outbox.lag",
            "exposedName": "ledger_outbox_lag_seconds",
            "origin": "source",
            "tags": [],
            "threshold": 60,
            "comparison": "<=",
            "good": "moments at which the oldest unpublished event was younger than the threshold",
            "valid": "every moment in the measurement window"
          },
          "target": 0.995,
          "windowDays": 30,
          "errorBudget": {
            "fraction": 0.005,
            "minutesPerWindow": 216.0
          },
          "introducedBy": "WP-09",
          "rationale": "The lag is the figure to state an objective over and the pending count is not, for the reason the runbook gives: a backlog of ten thousand draining steadily is a busy afternoon, and a backlog of one that has not moved in ten minutes is stuck. A minute is roughly one scrape interval, so an event older than that has missed the window in which the fraud scorer downstream would have seen it as part of the same moment."
        },
        {
          "objectiveId": "SLO-LEDGER-POOL-HEADROOM",
          "title": "No request waits for a database connection that is not there",
          "sli": {
            "kind": "timeRatio",
            "meterName": "hikaricp.connections.pending",
            "exposedName": "hikaricp_connections_pending",
            "origin": "framework",
            "tags": [
              "pool"
            ],
            "threshold": 0,
            "comparison": "<=",
            "good": "moments at which no thread was queued waiting for a connection from the pool",
            "valid": "every moment in the measurement window"
          },
          "target": 0.99,
          "windowDays": 30,
          "errorBudget": {
            "fraction": 0.01,
            "minutesPerWindow": 432.0
          },
          "introducedBy": "WP-23",
          "rationale": "A pool larger than the database can serve turns a slow query into a queue of held connections, and every transfer then waits behind it - which is why the pool is deliberately small and says so where it is configured. Pending is where that queue becomes visible, before latency moves and long before anything fails, so this objective is the earliest of the ledger's four to break. It is stated over the framework's own gauge rather than over a copy of it: Boot's Hikari binder already publishes this, and re-deriving it here would be a second instrument that could disagree with the first."
        }
      ],
      "signals": [
        {
          "meterName": "ledger.outbox.pending",
          "exposedName": "ledger_outbox_pending",
          "origin": "source",
          "tags": [],
          "meaning": "Events written but not yet published. Read from the table rather than accumulated in memory, so a restarted instance reports the truth immediately instead of starting again from zero.",
          "introducedBy": "WP-09",
          "noObjectiveBecause": "A count cannot tell a busy afternoon from a stuck relay, and an objective over it would fire on the first busy afternoon and be relaxed until it never fired at all. The objective is stated over the lag, which can tell them apart."
        },
        {
          "meterName": "hikaricp.connections.acquire",
          "exposedName": "hikaricp_connections_acquire_seconds",
          "origin": "framework",
          "tags": [
            "pool"
          ],
          "meaning": "How long a caller waited to be handed a connection. The other half of pool pressure: pending says how many are queued, this says what the queue cost them.",
          "introducedBy": "WP-23",
          "noObjectiveBecause": "It is the same pressure SLO-LEDGER-POOL-HEADROOM is stated over, seen as a duration rather than as a queue. Two objectives over one condition can disagree about whether it happened."
        },
        {
          "meterName": "hikaricp.connections.active",
          "exposedName": "hikaricp_connections_active",
          "origin": "framework",
          "tags": [
            "pool"
          ],
          "meaning": "Connections currently checked out. Against the maximum below, this is pool utilisation.",
          "introducedBy": "WP-23",
          "noObjectiveBecause": "Utilisation has no bad value on its own - a pool at ninety per cent is a pool being used. What matters is whether anybody had to wait, which is the objective above."
        },
        {
          "meterName": "hikaricp.connections.idle",
          "exposedName": "hikaricp_connections_idle",
          "origin": "framework",
          "tags": [
            "pool"
          ],
          "meaning": "Connections open and unused.",
          "introducedBy": "WP-23",
          "noObjectiveBecause": "It is the complement of active against the maximum, and an objective over it would be an objective about how quiet the bank is."
        },
        {
          "meterName": "hikaricp.connections.max",
          "exposedName": "hikaricp_connections_max",
          "origin": "framework",
          "tags": [
            "pool"
          ],
          "meaning": "The pool's configured ceiling, which is the denominator of every utilisation figure above.",
          "introducedBy": "WP-23",
          "noObjectiveBecause": "It is configuration read back, not behaviour. An objective over a setting is a category error."
        },
        {
          "meterName": "ledger.db.table.size",
          "exposedName": "ledger_db_table_size_bytes",
          "origin": "source",
          "tags": [
            "table"
          ],
          "meaning": "Heap size of each table the ledger owns, excluding its indexes.",
          "introducedBy": "WP-23",
          "noObjectiveBecause": "Growth is expected and unbounded growth is the concern, which needs a recorded normal and a trend rather than a threshold. F-28 records that nothing prunes outbox_record or idempotency_record, and the retention period that would justify a threshold is a regulatory question rather than an engineering one."
        },
        {
          "meterName": "ledger.db.index.size",